{
  "schema": "sg4.input.v1",
  "frame_id": 300,
  "timestamp_ms": 10000,
  "face": {
    "present": true,
    "confidence": 0.899
  },
  "eye": {
    "closure_prob": 0.096,
    "state": "open",
    "ear": 0.3,
    "confidence": 0.88
  },
  "mouth": {
    "yawn_prob": 0.026,
    "mar": 0.266,
    "confidence": 0.851
  },
  "head": {
    "pitch_deg": -2.26,
    "yaw_deg": -1.2,
    "roll_deg": 0.33,
    "confidence": 0.957
  }
}
